[
  {
    "id": "geeksuite",
    "name": "GeekSuite",
    "description": "Multi-application platform built using AI-assisted development workflows.",
    "technologies": ["React", "TypeScript", "Node.js", "Docker", "PostgreSQL"],
    "githubUrl": "https://github.com/clintgeek/GeekSuite",
    "websiteUrl": "https://geeksuite.clintgeek.com"
  },
  {
    "id": "geekpr",
    "name": "geekPR",
    "description": "Automated pull request review tooling for first-pass engineering feedback.",
    "technologies": ["Python", "GitHub Actions", "Gemini API"],
    "githubUrl": "https://github.com/clintgeek/GeekPR",
    "websiteUrl": ""
  }
]
